<?xml version="1.0" encoding="UTF-8"?>

<soccerLeague xmlns="http://ssdi.di.fct.unl.pt/ctxml/soccerLeague" xmlns:xsi="http://www.w3.org/2001/XMLSchema-instance"
    xsi:schemaLocation="http://ssdi.di.fct.unl.pt/ctxml/soccerLeague schema.xsd" id="SagresLeague1415">
    <players>
        <player id="Artur" position="GuardaRedes">
            <nick>Artur</nick>
            <nationality>Brasil</nationality>
            <birthDate>1981-01-25</birthDate>
            <awards>
                <award>award1</award>
                <award>award2</award>
            </awards>
            <playedClubs>
                <playedClub clubref="Benfica"/>
            </playedClubs>
        </player>
        <player id="Luisao" position="Defesa">
            <nick>Luisao</nick>
            <nationality>Brasil</nationality>
            <birthDate>1981-02-13</birthDate>
            <awards>
                <award>award3</award>
            </awards>
            <playedClubs>
                <playedClub clubref="Benfica"/>
            </playedClubs>
        </player>
        <player id="Samaris" position="Medio">
            <nick>Samaris</nick>
            <nationality>Grecia</nationality>
            <birthDate>1989-06-13</birthDate>
            <awards></awards>
            <playedClubs>
                <playedClub clubref="Benfica"/>
            </playedClubs>
        </player>
        <player id="N.Gaitan" position="Medio">
            <nick>Gaitan</nick>
            <nationality>Argentina</nationality>
            <birthDate>1988-02-23</birthDate>
            <awards>
                <award>award4</award>
                <award>award5</award>
            </awards>
            <playedClubs>
                <playedClub clubref="Benfica"/>
            </playedClubs>
        </player>
        <player id="Lima" position="Defesa">
            <nick>Lima</nick>
            <nationality>Brasil</nationality>
            <birthDate>1983-05-11</birthDate>
            <awards>
                <award>award6</award>
            </awards>
            <playedClubs>
                <playedClub clubref="Benfica"/>
            </playedClubs>
        </player>
        <player id="Maxi" position="Defesa">
            <nick>Maxi</nick>
            <nationality>Uruguay</nationality>
            <birthDate>1984-06-08</birthDate>
            <awards>
                <award>award22</award>
                <award>award23</award>
            </awards>
            <playedClubs>
                <playedClub clubref="Benfica"/>
            </playedClubs>
        </player>
        <player id="Salvio" position="Defesa">
            <nick>Salvio</nick>
            <nationality>Portugal</nationality>
            <birthDate>1987-09-28</birthDate>
            <awards>
                <award>award22</award>
            </awards>
            <playedClubs>
                <playedClub clubref="Benfica"/>
            </playedClubs>
        </player>
        <player id="Eliseu" position="Defesa">
            <nick>Eliseu</nick>
            <nationality>Portugal</nationality>
            <birthDate>1983-10-01</birthDate>
            <awards>
                <award>award22</award>
            </awards>
            <playedClubs>
                <playedClub clubref="Benfica"/>
            </playedClubs>
        </player>
        <player id="A.Talisca" position="Avancado">
            <nick>A.Talisca</nick>
            <nationality>Brasil</nationality>
            <birthDate>1994-02-01</birthDate>
            <awards>
                <award>award22</award>
            </awards>
            <playedClubs>
                <playedClub clubref="Benfica"/>
            </playedClubs>
        </player>
        <player id="Jardel" position="Defesa">
            <nick>Jardel</nick>
            <nationality>Brasil</nationality>
            <birthDate>1986-03-29</birthDate>
            <awards>
                <award>award22</award>
            </awards>
            <playedClubs>
                <playedClub clubref="Benfica"/>
            </playedClubs>
        </player>
        <player id="Perez" position="Medio">
            <nick>Perez</nick>
            <nationality>Argentina</nationality>
            <birthDate>1986-02-22</birthDate>
            <awards>
                <award>award22</award>
            </awards>
            <playedClubs>
                <playedClub clubref="Benfica"/>
            </playedClubs>
        </player>
        <player id="R.Patricio" position="GuardaRedes">
            <nick>Patricio</nick>
            <nationality>Portugal</nationality>
            <birthDate>1988-02-15</birthDate>
            <awards>
                <award>award7</award>
                <award>award8</award>
            </awards>
            <playedClubs>
                <playedClub clubref="Sporting"/>
            </playedClubs>
        </player>
        <player id="Jefferson" position="Defesa">
            <nick>Jefferson</nick>
            <nationality>Brasil</nationality>
            <birthDate>1988-07-05</birthDate>
            <awards>
                <award>award9</award>
            </awards>
            <playedClubs>
                <playedClub clubref="Sporting"/>
            </playedClubs>
        </player>
        <player id="A.Martins" position="Medio">
            <nick>Martins</nick>
            <nationality>Portugal</nationality>
            <birthDate>1990-01-21</birthDate>
            <awards></awards>
            <playedClubs>
                <playedClub clubref="Sporting"/>
            </playedClubs>
        </player>        
        <player id="Slimani" position="Avancado">
            <nick>Slimani</nick>
            <nationality>Algeria</nationality>
            <birthDate>1988-06-18</birthDate>
            <awards>
                <award>award10</award>
                <award>award11</award>
            </awards>
            <playedClubs>
                <playedClub clubref="Sporting"/>
            </playedClubs>
        </player>
        <player id="William" position="Avancado">
            <nick>William</nick>
            <nationality>Angola</nationality>
            <birthDate>1992-04-07</birthDate>
            <awards>
                <award>award12</award>
            </awards>
            <playedClubs>
                <playedClub clubref="Sporting"/>
            </playedClubs>
        </player>
        <player id="Nani" position="Avancado">
            <nick>Nani</nick>
            <nationality>Portugal</nationality>
            <birthDate>1986-11-17</birthDate>
            <awards>
                <award>award22</award>
                <award>award23</award>
            </awards>
            <playedClubs>
                <playedClub clubref="Sporting"/>
            </playedClubs>
        </player>
        <player id="Cedric" position="Defesa">
            <nick>Cedric</nick>
            <nationality>Portugal</nationality>
            <birthDate>1991-08-31</birthDate>
            <awards>
                <award>award22</award>
                <award>award23</award>
            </awards>
            <playedClubs>
                <playedClub clubref="Sporting"/>
            </playedClubs>
        </player>
        <player id="N.Sarr" position="Defesa">
            <nick>N.Sarr</nick>
            <nationality>Fran√ßa</nationality>
            <birthDate>1992-08-13</birthDate>
            <awards>
                <award>award22</award>
                <award>award23</award>
            </awards>
            <playedClubs>
                <playedClub clubref="Sporting"/>
            </playedClubs>
        </player>
        <player id="P.Oliveira" position="Defesa">
            <nick>P.Oliveira</nick>
            <nationality>Portugal</nationality>
            <birthDate>1992-01-08</birthDate>
            <awards>
                <award>award22</award>
                <award>award23</award>
            </awards>
            <playedClubs>
                <playedClub clubref="Sporting"/>
            </playedClubs>
        </player>
        <player id="J.Mario" position="Medio">
            <nick>J.Mario</nick>
            <nationality>Portugal</nationality>
            <birthDate>1993-01-19</birthDate>
            <awards>
                <award>award22</award>
                <award>award23</award>
            </awards>
            <playedClubs>
                <playedClub clubref="Sporting"/>
            </playedClubs>
        </player>
        <player id="CarriloD." position="Avancado">
            <nick>CarriloD.</nick>
            <nationality>Peru</nationality>
            <birthDate>1991-06-14</birthDate>
            <awards>
                <award>award22</award>
                <award>award23</award>
            </awards>
            <playedClubs>
                <playedClub clubref="Sporting"/>
            </playedClubs>
        </player>
        <!-- Estoril -->
        <!-- Estoril -->
        
        <player id="Matias" position="Medio">
            <nick>Matias</nick>
            <nationality>Uruguai</nationality>
            <birthDate>1986-05-16</birthDate>
            <awards>
                <award>award13</award>
                <award>award14</award>
            </awards>
            <playedClubs>
                <playedClub clubref="Estoril"/>
            </playedClubs>
        </player>
        <player id="Baltazar" position="Medio">
            <nick>Baltazar</nick>
            <nationality>Portugal</nationality>
            <birthDate>1995-04-15</birthDate>
            <awards>
                <award>award15</award>
            </awards>
            <playedClubs>
                <playedClub clubref="Estoril"/>
            </playedClubs>
        </player>
        <player id="J.Miranda" position="Avancado">
            <nick>Miranda</nick>
            <nationality>Cabo Verde</nationality>
            <birthDate>1989-08-02</birthDate>
            <awards></awards>
            <playedClubs>
                <playedClub clubref="Estoril"/>